Query,Result
i need keto recipies for weight lost,"Keto recipes can be beneficial for weight loss due to their focus on low-carb, high-fat foods. These recipes offer a balance of protein, healthy fats, and low carbohydrates to support weight loss goals. Keto recipes include Keto Chicken Pesto Zoodle Salad, Asian Keto chicken Stir-Fry, Keto Air Fryer Bacon, Egg, & Cheese Cups, Three-Cheese Cauliflower Casserole. The Keto Diet is a diet plan designed to help you lose weight."
Benefits of mediteranian diet,"The Mediterranean diet is known for its numerous health benefits, including lower rates of cardiovascular disease, reduced risk of Type 2 diabetes, lower blood pressure, and cholesterol levels. This eating pattern emphasizes whole foods such as vegetables, fruits, whole grains, lean proteins, and healthy fats like olive oil. Researchers have found that individuals following this eating pattern have better health outcomes compared to those on other diets. The Mediterranean diet has been recognized as one of the healthiest ways to eat by experts, emphasizing its positive impact on overall health."
What is the paleo diet and how does it work?,"Paleo diet is based on foods that humans might have consumed during the Paleolithic Era, which dates back to around 2.5 million to 10,000 years ago. It includes fruits, vegetables, lean meats, fish, eggs, nuts, and seeds. Scientific evidence suggests that the paleo diet may lead to short-term improvements in areas like chronic diseases and anthropometric measurements. But there is no conclusive scientific evidence that it is superior to other well-known diets like the Mediterranean diet."
Describe the main principles of the ketogenic diet.,"The ketogenic diet is based on consuming high-fat, low-carbohydrate, and moderate-protein foods to induce a state of ketosis in the body. This metabolic state shifts the body's primary energy source from glucose to ketones, leading to increased fat burning. Examples of ketogenic-friendly foods include avocados, nuts and seeds. The diet is also known as the keto diet or keto-diet. It is a modified form of the paleo diet, which is low in fat and high in protein."
How does the vegan diet affect heart health?,"A vegan diet has been shown to positively impact heart health in various ways. Plant-based diets have been linked to improved weight control, cardiovascular outcomes, blood pressure, insulin sensitivity, and a lower risk of diabetes. vegan diets may lack certain nutrients like vitamin B12, DHA, EPA, selenium, zinc, iodine, and calcium. The diet may also have a negative impact on the immune system and the body's ability to fight infections. The vegan diet can also have negative effects on the liver and kidneys."
What foods are allowed in a gluten-free diet?,"Choose whole, unprocessed foods like plain meat, poultry, fish, fruits, vegetables, nuts, beans, legumes, eggs, and dairy. Be cautious of seasonings and marinades that may contain gluten. Avoid soy sauce as it is made from wheat. Be careful with salt and sugar as they can contain gluten, as they are made from the same material as wheat. Avoid sugar and salt-based sauces as they contain gluten and are high in calories. Avoid salt- and sugar-based marinade as it contains gluten and is high in calorie."
What is the best diet for sustainable weight loss?,"The Plate Method consists of half your plate being vegetables and fruit, one quarter protein, and one quarter grains/starches. The Mediterranean Diet, based on Mediterranean countries' traditional diets, is known for its balance and sustainability. WW (formerly Weight Watchers) is recognized as a top diet for weight loss in 2024, according to a new report by the American Dietetic Association (ADPA) The ADPA says the Mediterranean Diet is the most effective way to lose weight in the U.S."
How does intermittent fasting help with weight loss?,"Intermittent fasting can aid in weight loss by helping to reduce overall calorie intake and improve metabolic health. Studies have shown that following fasting regimens, such as the 16:8 method, can lead to weight loss of around 3% of body weight over a few months"
What are the most effective low-calorie diets?,"The Mediterranean diet, the DASH diet, and the MIND diet prioritize whole, unprocessed foods that nourish the body. Other highly ranked low-calorie diets include the Mayo Clinic diet, flexitarian diet, WeightWatchers, volumetrics diet, Dr. Weill’s Anti-Inflammatory diet, among others. The Mediterranean diet is one of the most popular diets in the U.S., according to a recent survey by the American Dietetic Association."
What are the health benefits of a high-protein diet?,"A high-protein diet offers several health benefits, including weight loss support, improved bone health, enhanced appetite control, and increased willpower. Examples of high- protein foods include lean meats, fish, dairy products, beans, nuts, and seeds"
Why is fiber important in a balanced diet?,"Fiber is crucial in a balanced diet due to its association with reduced risk of chronic diseases. It aids in weight management, improves digestion, and helps prevent constipation. Adequate fiber intake is likened to a ""nature's scrub brush"" for the body. It reduces the risk of diverticulitis, according to the American Dietetic Association"
Explain the role of omega-3 fatty acids in brain health.,"Omega-3 fatty acids, particularly DHA, play a crucial role in brain health. They are essential for maintaining the structural and functional integrity of the nervous system. Incorporating omega-3-rich foods into the diet can have significant benefits for brain health and overall well-being. In the U.S. call the National Suicide Prevention Line on 1-800-273-8255."
Explain the role of omega-3 fatty acids in brain health.,"Omega-3 fatty acids, specifically EPA and DHA found in fish oil, play a crucial role in brain health. They are polyunsaturated fats responsible for various brain and mental health benefits. These fatty acids are known for their anti-inflammatory effects."
Why is hydration important for metabolism?,"Water plays a crucial role in various metabolic processes, including glucose processing. Dehydration can lead to challenges in metabolic function and may increase the risk of metabolic diseases. Practical tips to ensure adequate hydration include drinking water throughout the day and monitoring urine color for hydration levels."
What are the key components of a diabetic-friendly diet?,"Diet rich in nutrients and low in fat and calories is beneficial for managing diabetes. Key components of a diabetic-friendly diet include consuming fruits, vegetables, and whole grains in moderation. Practical tips include focusing on maintaining blood glucose levels within a healthy range."
Describe a diet plan for managing high cholesterol.,"Therapeutic Lifestyle Changes (TLC) diet is rich in fruits, vegetables, whole grains, lean proteins, and healthy fats. Scientific evidence suggests that consuming 5 to 10 grams of soluble fiber daily can decrease LDL cholesterol levels. Examples of foods to include are brown rice, apples, pears, kidney beans, and oatmeal or oat bran."
What are good food choices for individuals with celiac disease?,"Research suggests that individuals with celiac disease can safely consume moderate amounts of gluten-free oats to diversify their diet. However, it is crucial to ensure that the oats are certified gluten- free to prevent cross-contact with gluten-containing grains."
How can a plant-based diet help reduce inflammation?,"Plant-based diets lead to better cholesterol levels, improved blood sugar control, lower body mass index, and decreased inflammation. By replacing animal-based foods with vegetables, fruits, nuts, and legumes, individuals can significantly reduce inflammation. Practical tips for adopting a plant-based diet include focusing on whole, unprocessed plant foods."
"What is a low-sodium diet, and who should follow it?","A low-sodium diet is an eating plan recommended for individuals looking to reduce their sodium intake. It is particularly suggested for managing certain medical conditions such as heart failure. Consuming foods prepared at home can help lower sodium intake, as outside foods are a significant source of sodium."
What are the best pre-workout meals for energy?,"Aim for 0.4-0.5 g/kg of lean body mass of protein, which is roughly 20-40 grams. Examples of good pre-workout meals include whole grain toast with almond butter and fruit. For snacks 30-60 minutes before training, options include a banana with Greek yogurt."
Describe the ideal post-workout nutrition for muscle recovery.,"The ideal post-workout nutrition for muscle recovery includes a 4:1 carbohydrate to protein ratio. Light stretching and movement can help increase blood flow to the muscles. Adequate sleep, typically 7-9 hours, is essential for optimal muscle recovery."
What is the role of protein in muscle building?,"Protein plays a crucial role in muscle building as it is responsible for the growth, repair, and maintenance of muscle tissues. Scientific evidence suggests that a protein intake of 1.2 to 1.6 grams per kilogram of body weight per day can support muscle building."
How does carb cycling work for athletes?," Carb cycling is a dietary strategy where athletes alternate between high and low carbohydrate intake days. This method is particularly popular among endurance athletes and bodybuilders aiming to optimize energy levels, drop body fat, or enhance muscle mass. It involves planned increases and decreases in carb consumption, often in conjunction with calorie adjustments."
What is a balanced meal plan for endurance athletes?,"A balanced meal plan for endurance athletes typically includes 8 to 10 grams of carbohydrate per kilogram of body weight per day. Endurance athletes should also focus on meeting their protein and fat needs, staying hydrated and considering supplements like caffeine, nitrates, probiotics, and antioxidants."
Provide a 7-day vegan meal plan.,"A 7-day vegan meal plan can be structured to provide balanced and nutritious meals. Practical tips include incorporating a variety of plant-based foods. A day's macronutrient breakdown can be around 1,900-2,100 calories."
What is an easy meal plan for a busy schedule?,Meal planning can help reduce food waste and make healthy eating easier. Practical tips include customizing meal plans to suit your goals. One Pan Ranch Pork Chops and Veggies and No-Boil Baked Penne With Meatballs are examples of easy meals.
Describe a budget-friendly healthy meal plan.,"A budget-friendly healthy meal plan can be achieved by incorporating tips such as meal prepping, buying in bulk, and focusing on plant-based proteins. Planning meals around seasonal produce can also help save money. By utilizing these strategies it is possible to eat healthily while staying within a budget."
How to meal prep for a high-protein diet?,"Plan your meals ahead of time to ensure you meet your protein requirements for each day. Incorporate protein-rich snacks like Greek yogurt, nuts, and protein bars for quick and easy options. Use these tips and examples to meal prep for a high-protein diet."
What is a good Mediterranean meal plan for beginners?,"Aim to include at least 7 to 10 servings of fruits and vegetables each day. Include legumes like lentils, chickpeas, and black beans for plant-based protein. Opt for healthy fats like olive oil, nuts, and seeds."
What are the benefits of taking multivitamins?,"There is no concrete evidence that multivitamins can prevent diseases. Whole foods like whole grains, fruits, vegetables, lean proteins, and healthy fats should be the foundation of a healthy diet. Consistency in taking multvitamins, combined with a nutritious diet, can contribute to overall well-being."
Explain the role of protein supplements in a diet.,"Protein supplements play a crucial role in a diet by supporting muscle protein synthesis. The ideal amount of protein intake depends on various factors such as caloric intake, training status, age, and type of protein consumed. Combining protein with carbohydrates post-exercise can further enhance muscle protein balance."
What are the best supplements for boosting energy?,"The best supplements for boosting energy include Morning Kick by Roundhouse Provisions. These supplements contain ingredients like caffeine, amino acids, polyphenols, and adaptogens that enhance alertness and increase energy levels. Practical tips for boostingEnergy include incorporating these supplements into your daily regimen, focusing on digestive health, and maintaining a health-conscious lifestyle."
How do omega-3 supplements help reduce inflammation?,"Omega-3 fatty acids play a crucial role in modulating eicosanoid production. Chronic inflammation is linked to various diseases such as dementia, Alzheimer's, rheumatoid arthritis, heart disease, diabetes, and cancer. It is recommended to consult with a healthcare provider before starting any supplementation regimen."
What are common side effects of pre-workout supplements?,"Common side effects of pre-workout supplements include addiction, sickness, itching, jitteriness, insomnia or difficulty sleeping. Practical tips to minimize these effects include starting with a lower dose, avoiding proprietary blends, and staying hydrated."
Is there scientific evidence supporting the keto diet for diabetes?,"A low-carb ketogenic diet can lead to significant decreases in HbA1c levels, reduced daily insulin use, and weight loss in individuals with Type 1 diabetes. Studies have also demonstrated that a ketogenic Diet can be feasible for diabetes management. Patients instructed to consume <20g of carbohydrates from green vegetables and salads."
What are the latest studies on the benefits of a plant-based diet?,"A review of 49 studies conducted between 2000 and 2023 concluded that vegetarian and vegan diets offer significant health advantages. A study on over 2,000 men with localized prostate cancer revealed a 47% lower risk of cancer progression compared to those who consumed more animal products."
How effective are low-carb diets according to recent research?,"Low-carbohydrate diets (LCDs) have shown effectiveness in weight loss and improving metabolic markers. Practical tips for following a low-carb diet include prioritizing whole foods like vegetables, lean proteins, and healthy fats. It is important to consult with a healthcare provider before making significant dietary changes."
What are the long-term effects of calorie restriction diets?,Research suggests that restricting calories by 20% to 60% can promote longer life in animals and may slow down aging in humans. Long-term calorie restriction interventions have been found to be more effective in weight loss and body composition improvement compared to short-term interventions.
How can you reduce sugar intake in a typical diet?,"Choose dark chocolate over milk or white chocolate for lower sugar content. Avoid sugary drinks like soda, sports drinks, and flavored lattes. Incorporate foods like oats, oat bran, chia seeds, and eggs into your diet to help regulate blood sugar levels. The American Diabetes Association recommends a low-calorie, low-sugar diet."
What are good sources of plant-based protein?,"Good sources of plant-based protein include nutritional yeast, tempeh, firm tofu, edamame beans, and hummus. Firm tofu contains about 10 grams ofprotein per 1/2 cup. Hummus is a versatile option to add protein to meals. Plant-based proteins also offer added fiber, promoting good gut bacteria and aiding digestion and blood sugar regulation. The more fiber you add, the more protein you get.  The more protein, the less fiber you get, the better your diet."
Describe healthy snacks for weight loss.,"Healthy snacks for weight loss can include foods high in protein or fiber such as oatmeal, whole fruit, nuts, popcorn, Greek yogurt, guacamole, bell pepper strips, and turkey pepperoni. Incorporating these nutrient-rich snacks into your diet, along with practicing portion control and mindful eating, can contribute to a successful weight loss journey. For example, avocados contain monounsaturated fats which can help prevent unhealthy weight gain. Nuts, while high in calories, when consumed in moderation, may support weight loss efforts."
How to create balanced meals using the MyPlate method?,"The USDA's MyPlate guide offers practical advice for balanced meals. Fill half your plate with nonstarchy vegetables, a quarter with lean protein, and one quarter with carbohydrate foods. Examples of balanced meals include over-hard eggs with whole grain toast, sautéed veggies, and avocado, or Greek yogurt with low-sugar granola, berries, and nut butter. Utilize resources like the My Plate Kitchen for recipes and tips on building healthy and budget-friendly meals."
What foods can help reduce anxiety?," foods rich in omega-3 fatty acids like salmon, chia seeds, and walnuts can help reduce anxiety symptoms. Foods high in antioxidants such as berries, dark chocolate, and green tea have also been shown to have a calming effect on the body. It is important to note that while these foods can help in reducing anxiety, they should be part of a holistic approach that includes stress management, proper sleep, and regular exercise"
Describe a diet that supports cognitive function.," Mediterranean, DASH, and MIND diets have shown cognitive benefits. These diets emphasize fruits, vegetables, whole grains, lean proteins, and healthy fats. Practical tips include incorporating these foods into meals regularly and staying hydrated. The Mediterranean diet is a low-carb, high-fat, low-sugar diet. The MIND diet emphasizes lean proteins and lean proteins while limiting processed foods and sugar. The DASH diet emphasizes whole grains and fruits, while limiting sugar and processed foods."
How does nutrition affect mood and mental health?,"Diets high in refined carbohydrates and sugars have been associated with an increased risk of depressive symptoms. consuming a diet rich in fibers, polyphenols, and unsaturated fatty acids, as seen in a Mediterranean diet, can promote a healthy gut microbiome. Scientists have shown that changes in the gut microbiome can influence emotional behavior in rodents. transferring gut microbiota from humans with depression to rodents can induce depression-like behaviors. This can positively impact mental health by producing anti-inflammatory metabolites. The study was published in the Journal of Clinical Nutrition."
What are the best foods for improving memory?,"Scientific evidence supports the benefits of these foods for brain health and memory improvement. For example, omega-3 fatty acids in fish have been linked to improved cognitive function. Berries are rich in antioxidants that help protect brain cells from damage. Whole grains provide a steady supply of energy to the brain. Coffee, which contains caffeine, has been shown to have positive effects on brain function and may reduce the risk of neurological diseases like Parkinson's and Alzheimer's. Incorporating these foods into your diet can help support brain health."
Can a balanced diet help with depression?,"Scientific evidence suggests that high intake of processed foods may increase the risk of depression. These foods are often low in crucial nutrients like B12, magnesium, and folic acid. Conversely, diets rich in fruits, vegetables, and fiber have been associated with a reduced risk of Depression. A balanced diet can indeed help with depression by providing essential nutrients that support mental health. Consuming foods like leafy greens, berries, tomatoes, avocadoes, mushrooms, turkey, salmon, walnuts, and milk can help boost mood."
What are the best pre-workout meals for energy?,"Scientific evidence suggests that consuming carbohydrates before a workout can enhance performance by providing readily available energy for your muscles. Protein helps with muscle repair and growth, which is beneficial for recovery post-workout. Aim for a balance of complex carbohydrates, lean proteins, and healthy fats. Drink water before your workout to stay hydrated and support optimal performance.Remember to listen to your body and adjust your pre- workout meals based on your individual needs and preferences"
Describe the ideal post-workout nutrition for muscle recovery.,"The ideal post-workout nutrition for muscle recovery includes consuming 20-30 grams of high-quality protein within 30-60 minutes after exercising. Pairing protein with carbohydrates helps replenish glycogen stores and enhance recovery. Sources of protein like whey protein, chicken breast, Greek yogurt, and eggs are recommended. Additionally, incorporating healthy fats into your overall diet supports muscle recovery. Consuming foods like scrambled eggs on toast, protein smoothies, and chocolate milk can provide the necessary nutrients for optimal recovery."
What should I eat before and after strength training?,"It is crucial to consume a post-workout meal as your body enters an anabolic state after exercise. This ""anabolic window"" is a critical time to provide your body with the nutrients it needs for optimal recovery. A suggested post- workout meal is a whey protein shake, 100g of chicken breast, and half a cup of rice. Some examples include oats with Greek yogurt and fruit, eggs with spinach and potatoes, or a meal of meat, rice, and vegetables."
How does protein intake affect muscle recovery post-workout?,"Protein intake post-workout plays a crucial role in muscle recovery due to its ability to promote muscle gain and repair. Adequate protein intake is associated with improved strength, power, balance, and exercise tolerance, reducing the risk of injury. It is recommended to consume a balanced post- workout meal containing protein and carbohydrates to maximize the benefits of protein intake on muscle recovery. The blend supports muscle gain, energy recovery, and lean muscle mass maintenance. It also helps with energy recovery and muscle mass Maintenance."
What are the best carb sources for endurance athletes?,"The best carb sources for endurance athletes include Maltodextrin, Cane Sugar, Fructose, and bananas. Bananas, in particular, are praised for their natural sugars, potassium, and magnesium content. For optimal performance, it's recommended to consume 3-5 grams of carbohydrates per 1-pound body weight, starting 1-3 days before a race. The best carbohydrate sources offer high carbohydrate content and efficient absorption rates without causing stomach upset, according to the American College of Sports Medicine."
What is the best diet for endurance athletes?,"The best diet for endurance athletes varies based on individual needs. Consuming 30-35% of daily calories from fats, focusing on sources like fatty fish, grass-fed meats, organic dairy, nuts/seeds, and avocados. Monitoring key nutrients for vegetarian athletes, such as vitamin B12, folate, vitamin D, and iron. Prioritizing adequate hydration and electrolyte intake to support performance and recovery. Remember, individual responses to different diets may vary so it's essential for athletes to experiment and find what works best for their own bodies."
How can nutrition support high-intensity interval training (HIIT)?," nutrition plays a crucial role in supporting high-intensity interval training (HIIT) Pre-HIIT meals should include a balance of carbohydrates for energy and protein for muscle repair. Post-workout nutrition is essential to replenish glycogen stores and aid in muscle recovery. optimizing nutrition by fueling appropriately before and after HIIT sessions can maximize performance, aid in recovery, and support overall health and fitness goals, according to the American College of Exercise and Sport Nutrition (ACOS) The ACOS recommends consuming a balanced meal 2-3 hours before a workout and incorporating whole foods rich in nutrients."
Describe a meal plan for someone training for a marathon.,"Aim for a carb-to-protein ratio of 3:1 in post-training meals to support glycogen recovery and muscle repair. Examples of meals include Greek yogurt with berries for a pre-run snack, quinoa bowl with black beans and chicken for lunch, and salmon fillet with brown rice for dinner. Ensure a daily carbohydrate intake of 50-65% of total calories to fuel your long runs effectively. Remember to hydrate adequately and listen to your body's needs for optimal performance during marathon training."
What are the key nutrients for building muscle mass?,"Key nutrients for building muscle mass include high-quality protein, complex carbohydrates, and healthy fats. Protein is essential for muscle growth, with sources like lean meats, eggs, chicken, salmon, Greek yogurt, and skim milk being great options. carbohydrates provide energy for workouts and support recovery, while healthy fats help with hormone production and overall health. It's important to have a balanced diet with these nutrients to optimize muscle building"
How should a diet be adjusted for strength vs. cardio training?,"When adjusting your diet for strength training versus cardio training, it is important to consider the specific nutritional needs of each type of exercise. Strength training helps build lean muscle mass, so it is essential to consume an adequate amount of protein to support muscle repair and growth. cardio training focuses on endurance and cardiovascular health. Opt for complex carbohydrates like whole grains, fruits, and vegetables to fuel your cardio sessions effectively. Stay hydrated is key for both strength and cardio training to maintain performance and aid in recovery."
