Query,Result
How does sleep quality influence exercise performance and recovery?,"Sleep disorders are relatively common among elite athletes. Poor sleep quality can lead to various negative effects on physical performance, mental performance, injury risk, and recovery. Practical tips to improve sleep quality include establishing a consistent sleep schedule, creating a relaxing bedtime routine, and avoiding stimulants close to bedtime"
Evaluating the effectiveness of ketogenic diets for endurance sports.,"The Endurance Athlete's Ketogenic Diet (EAKD) may impact maximal oxygen consumption (VO2 max) and secondary performance outcomes positively. The International Society of Sports Nutrition (ISSN) emphasizes the need for critical evaluation of ketogenic diets in healthy exercising adults. EAKD is a low-carb, high-fat, low-calorie diet. It is a form of keto-dieting known as a ketogenic diet (KD) or keto keto."
Nutritional strategies for managing fatigue during long-distance cycling.,"Nutritional strategies for managing fatigue include consuming 60-90g of carbs per hour for rides lasting longer than an hour. Hydration is crucial; mixing water with electrolytes is advised to replace lost electrolytes and sugar. Cycling nutrition products are recommended for easily digestible carbs. For more cycling news, visit CNN.com/Cycling and follow us on Twitter @cnncycling and @CNNCycling. For all the latest from CNN, visit our in-depth magazine and magazines."
Impact of dietary fat intake on cardiovascular health in runners.,"Research suggests that the type of fat consumed, rather than total fat intake, plays a crucial role in cardiovascular health for runners. Higher intake of linoleic acid, an omega-6 fatty acid, is associated with lower risks of coronary heart disease, cancer, and total mortality. It is a type of fatty acid that is found in fish, eggs, nuts, seeds, vegetables, meat, fish, poultry, fish oils, eggs and dairy products. It can also be found in nuts and seeds, such as avocados, walnuts, avocadoes, blueberries and blueberries."
Adjusting caloric intake for weight maintenance during off-season training.,"During off-season training, adjusting caloric intake for weight maintenance involves consuming a caloric surplus only on training days. This approach helps ensure a steady increase in body weight with minimal fat gain. It is recommended to include lean protein at every meal and snack and avoid sugary beverages"
The benefits of incorporating whole foods into a sports nutrition plan.,"A diet rich in whole foods provides essential nutrients, antioxidants, and fiber. Whole foods are minimally processed and include fresh fruits, vegetables, nuts, seeds, whole grains, fish, and olive oil. Practical tips for incorporating whole foods into a sports nutrition plan include meal prepping with whole ingredients.  The Daily Discussion is a weekly, offbeat look at the latest in the Daily Discussion. This week, we look at how to get the most out of your sports nutrition plans."
How do different types of carbohydrates affect workout performance and recovery?,"The type of carbohydrate consumed can influence factors such as osmotic effects, digestibility, glycemic response, and insulin levels. Co-ingestion of fructose with glucose can accelerate the recovery of liver glycogen stores. Proper hydration along with carbohydrate availability is essential in preventing muscular or central fatigue during exercise. The best way to avoid fatigue is to drink plenty of water and eat a balanced diet"
Understanding the impact of caffeine on endurance and strength training.,"Caffeine has been shown to enhance muscular endurance, but its effects on maximal muscle strength and muscle power are still unclear. Possible mechanisms for caffeine's performance-enhancing effects include calcium release from the sarcoplasmic reticulum and preservation of muscle glycogen. It is essential to understand individual responses to caffeine and adjust consumption accordingly. The study was published in the Journal of the American College of Cardiology. The author is a professor of cardiology at the University of California, Los Angeles."
Exploring the role of micronutrients in supporting immune function for athletes.,"Micronutrients play a crucial role in supporting immune function for athletes. Key micronutrient include vitamins A, D, C, E, B6, B12, folate, zinc, iron, copper, and selenium. Micronut nutrients also play a key role in vitamins B, B5, B7, B8, B9, B10, B11, B13, B14, B15, B16, B17, B18, B19, B20, B21, B22, B24, B25, B26, B27, B28, B29, B30, B31, B32,"
The relationship between gut health and overall fitness performance.,The relationship between gut health and overall fitness performance is significant. Studies indicate that exercise can influence gut microbiota diversity. Having a diverse range of bacteria in the gut may reduce the risk of various health conditions. Practical tips to improve gut health include consuming foods high in polyphenols. In the U.S. call the National Suicide Prevention Line on 1-800-273-8255.
Guidelines for optimizing protein intake for muscle repair after resistance training.,"To optimize protein intake for muscle repair after resistance training, it is recommended to consume 1.2–2.0 g of protein per kilogram of body weight per day. Whole food sources are preferred for protein consumption as they contain multiple macro- and micronutrients, fiber, and other essential components. For help with getting more protein, visit the Protein.org website."
What is the best post-workout meal for faster recovery?,"The best post-workout meal for faster recovery should include a balance of protein, carbohydrates, and healthy fats. A meal with a ratio of 3:1 of carbs to protein is recommended to enhance glycogen storage and muscle protein synthesis. It's important to consume this meal within the optimal timing window after exercise. The best time to eat is between 5 and 7pm, depending on your weight and activity level. For more tips on how to eat healthily after a workout, visit CNN.com/health."
How to manage macronutrient ratios for optimal energy during intense workouts.,"For high-intensity training, carbohydrates are the primary energy source. A typical macronutrient distribution for athletes includes 60% carbohydrates, 20% protein, and 20% fat. Consult with a nutritionist to develop a personalized plan for individual needs. for more information about eating healthily and how to get the most out of your food, visit http://www.nurserydirect.com/healthy-eating."
Benefits of including fermented foods in an athlete's diet.,"Fermentation can enhance the bioavailability of certain nutrients, aiding in better absorption by the body. Fermented foods can also support gut health by promoting a healthy balance in the gut microbiome. Practical tips for athletes looking to incorporate fermented foods into their diet include adding options like yogurt, kefir, sauerkraut, kimchi, and kombucha. Fermented foods are a great way to boost your body's ability to absorb nutrients, according to the American College of Nutrition."
The impact of high-protein diets on muscle synthesis and overall health.,"High-protein diets have been shown to positively impact muscle protein synthesis. Examples of high-protein foods that can support muscle synthesis include eggs, Greek yogurt, cottage cheese, quinoa, lentils, and lean meats like turkey and chicken. High-protein diet is essential for muscle growth and repair, according to the American Journal of Clinical Nutrition"
How to balance calorie intake with physical activity for weight loss.,"The Centers for Disease Control and Prevention recommends at least 150 minutes per week of moderate-intensity activities like brisk walking. Maintaining a healthy balance involves aiming for specific percentages of total calories, which can vary based on individual needs and goals. It is crucial to be mindful of portion control to ensure that calorie intake aligns with physical activity levels. The CDC recommends a daily intake of 1,000 to 1,500 calories"
Effectiveness of different types of stretching before and after exercise.,"Dynamic stretching, such as shoulder rolls and walking lunges, is recommended before a workout to help warm up the body. On the other hand, static stretching, like overhead triceps or standing hamstring stretches, is beneficial after exercise to help cool down and improve flexibility. For information on stretching in the office, visit the office of a personal trainer or call the gym on 08457 90 90 90 or visit a local gym."
Nutritional considerations for improving endurance in long-distance runners.,"Nutritional considerations for improving endurance in long-distance runners include: Carbohydrates are essential for fueling endurance activities. Protein is crucial for muscle repair and recovery, so including lean sources such as poultry, fish, beans, and dairy is important. Keto-adaptation may enhance the body's ability to burn fat, potentially providing a sustainable energy source. It may also provide the body with a sustainable source of energy to fuel its activities. It can also help the body burn fat more efficiently."
How meal timing affects performance and recovery in competitive athletes.,"Meal timing plays a crucial role in the performance and recovery of competitive athletes. Research indicates that nutrient timing before exercise, typically within 4 hours prior, involves specific dietary tactics. The International Society of Sports Nutrition emphasizes the importance of macronutrient timing in relation to exercise for healthy, exercising adults. In the U.S. call the National Suicide Prevention Line on 1-800-273-8255."
Understanding the benefits of hydration supplements for athletes.,"Hydration supplements can benefit athletes by optimizing pre-exercise hydration with 500 mL of water 2 hours before an event. Consistent monitoring of daily water intake is crucial for maintaining hydration levels. Assessing hydration status in athletes is essential, with practical solutions available to overcome sport-specific obstacles. In the U.S. call the National Suicide Prevention Line on 1-800-273-8255."
The role of vitamins and minerals in enhancing athletic performance.,"Vitamins and minerals play a crucial role in enhancing athletic performance. Specific micronutrients such as iron, vitamin C, vitamin E, vitamin D, and calcium have been highlighted for their impact on athletes. Adequate vitamin intake is vital for protecting athletes from injury and improving performance. Vitamin D, iron, C, E, Vitamin D, calcium, and iron are among the micronuts most important for athletes to consume.  Vitamin C is the most important vitamin for athletes."
How to create a diet plan that supports both muscle gain and fat loss.,"Aim for a diet rich in lean protein, complex carbohydrates, healthy fats, and fiber. Consume around 1-1.5 grams of protein per pound of bodyweight daily. Don't neglect healthy fats such as avocados, nuts, seeds, and olive oil. Aim to eat no more than 1.5 to 2 grams of fiber per day, according to the American Dietetic Association (ADA) diet guide to healthy eating. Aim for 1-2 grams of fibre per day and 1-3 grams of complex carbohydrates per day."
The impact of sugar consumption on exercise performance and recovery.,"Sugar consumption can play a significant role in exercise performance and recovery for athletes. The impact of sugar on athletes is influenced by factors such as energy balance, exercise intensity, and individual circumstances. The benefits of sugar intake for athletes are nuanced and depend on various factors, such as exercise intensity and energy balance"
Guidelines for designing a nutrition plan for strength training and bodybuilding.,"To design a nutrition plan for strength training and bodybuilding, it is essential to focus on creating a calorie deficit or surplus. Energy balance, which is the variance between calories consumed and burned, plays a crucial role in achieving desired outcomes. A typical weekly meal plan may involve prioritizing specific foods while limiting or avoiding others. For more info on strength and fitness, visit muscleand fitness.com."
How to incorporate anti-inflammatory foods into a sports nutrition plan.," fatty fish rich in omega-3 fatty acids like salmon, tuna, mackerel, sardines, and herring have powerful anti-inflammatory properties. Aim to include a variety of fruits and vegetables high in fiber, polyphenols, vitamins, and minerals in your diet. Aim for a balanced diet of fruits, vegetables and lean meat and fish with lots of fiber, vitamins and minerals, and plenty of protein"
Evaluating the role of dietary fiber in athletic performance and recovery.,"Dietary fiber plays a crucial role in athletic performance and recovery by influencing body composition, energy levels, and overall health. It is recommended to gradually increase fiber intake to avoid gastrointestinal discomfort. Fiber-rich foods help maintain stable blood sugar levels, promote satiety, and support digestive health, all of which are essential for athletes. For confidential support, call the Samaritans on 08457 90 90 90, visit a local Samaritans branch or click here for details."
What are the best recovery practices following intense exercise sessions?,"To optimize recovery following intense exercise sessions, it is recommended to: Consume a post-workout meal with a 4:1 carbohydrate to protein ratio to enhance absorption of nutrients. These practices are supported by the International Society of Sports Nutrition and experts in the field of exercise science. To optimize recovery after an intense exercise session, it's recommended to consume a 4-1 carbohydrate-to-protein ratio. This ratio is to help ensure that the body absorbs all of the nutrients it needs to recover."
Tips for maintaining energy levels during extended periods of physical activity.,"Stay hydrated by drinking at least 8-10 glasses of water a day. Consume a balanced diet of carbohydrates, protein, and fat. Gradually increase the intensity of your workouts. Avoid fatigue-inducing medications. Be aware of your body's body's signals and be aware of how your body is feeling.    Be conscious of how you are feeling and respond to your body’s signals. Stay hydrated and stay away from alcohol and drugs that can cause fatigue."
The effect of a low-fat diet on athletic performance and endurance.,"A low-carbohydrate, high-fat (LCHF) diet has been suggested to potentially enhance fat utilization and aerobic capacity in endurance athletes. However, the impact of shifting macronutrient intake from carbohydrates to fats on endurance exercise training and performance is still uncertain"
How to use meal prepping to support a consistent nutrition plan for athletes.,"Meal prepping is a valuable tool to support a consistent nutrition plan for athletes. Planning meals 3-4 days ahead allows athletes to align their diet with their training schedule and energy requirements. Preparing protein sources like chicken, fish, or steak in portioned sizes streamlines the process.  Preparing meals in bulk can also be a great way to get the most out of your protein intake in a small amount of time"
Benefits of including omega-3 supplements in an athlete's diet.,"Omega-3 fatty acids have been shown to impact the health and performance of athletes positively. Some evidence suggests that omega-3s can improve endurance capacity by acting as a vasodilator, increasing oxygen flow. Studies emphasize the importance of the quantity and duration of EPA and DHA supplementation in determining the effects on performance. In the U.S. call the National Suicide Prevention Line on 1-800-273-8255."
How a high-carbohydrate diet can support long-term athletic performance.,"Carbohydrates are the body's preferred energy source during exercise. Examples of high-carbohydrate foods that can support athletic performance include oatmeal, brown rice, sweet potatoes, bananas, and quinoa. Scientific evidence suggests that a diet rich in carbohydrates can enhance athletic performance by replenishing glycogen stores in muscles"
The role of electrolytes in maintaining hydration and performance during exercise.,"Electrolytes play a crucial role in maintaining hydration and optimizing performance during exercise. Sodium, in particular, helps control water retention and release in the body. Incorporating electrolyte-rich beverages or supplements can help replenish lost electrolytes.  Electrolytes can also be found in fruit, vegetables, nuts, seeds, legumes, legume, fish and dairy products, as well as in sports drinks and juices"
How to adjust nutrition strategies for different types of athletic training.,"Sports nutrition plays a vital role in optimizing performance and aiding recovery. To adjust nutrition strategies for different types of athletic training, it's crucial to tailor dietary plans. Factors such as the type of sport, training intensity, competition timing, and season length should be considered when determining an athlete's nutrition requirements. For confidential support on suicide matters call the Samaritans on 08457 90 90 90, visit a local Samaritans branch or see www.samaritans.org."
Effective meal planning for muscle gain and endurance.,"A well-rounded meal plan tailored to your goals and adjusting based on individual needs can support both muscle gain and endurance effectively. A sample 7-day meal plan for muscle gain includes lean proteins, complex carbs, and healthy fats, providing around 3000-3500 calories per day"
How does a vegetarian diet impact energy levels for athletes?,"A well-planned vegetarian diet can lead to improvements in physical fitness. Research shows a significant increase in maximal performance and VO2 max in athletes following a vegetarian diet compared to omnivorous diets. vegetarian diets may not always meet daily protein recommendations, which are particularly important for athletes. The American Dietetic Association recommends eating a balanced vegetarian diet"
Tips for managing blood sugar levels during intense workouts.,"Intense exercise increases insulin sensitivity and glucose uptake by the body's cells. It is recommended to test blood sugar levels every 30 minutes during long workouts or new activities. Consuming a small snack containing 15 to 30 grams of carbohydrates before working out can help maintain adequate levels. The NHS recommends eating a small portion of fruit, vegetables and lean meat before going out for a workout"
The influence of dietary fats on athletic performance and recovery.,"Dietary fats play a crucial role in athletic performance and recovery. Omega-3 fatty acids are particularly beneficial for athletes due to their anti-inflammatory properties. On the other hand, saturated and trans fats should be limited as they can lead to inflammation and hinder recovery. The American College of Nutrition recommends eating a balanced diet, including fish and nuts, as well as lean meat, vegetables and fruit"
How to create a balanced diet for optimal performance in team sports.,"Athletes should focus on carbohydrates, protein, fat, vitamins, and minerals. Micronutrients like iron, calcium, magnesium, and vitamins C, D, and E are crucial for athletic performance. Pre- and post-workout snacks can help fuel workouts and aid recovery. For additional information on packing healthy snacks, visit CNN.com and follow us on Facebook."
The benefits of a Mediterranean diet for cardiovascular health and exercise.,"The Mediterranean diet has been extensively studied for its benefits on cardiovascular health. Research shows that this diet can lower blood pressure, reduce cholesterol levels, and decrease the risk of developing Type 2 diabetes. This diet is not only about the specific foods consumed but also about embracing a lifestyle that emphasizes social connections and physical activity. The Mediterranean diet is also known for its high levels of physical activity and low levels of alcohol and tobacco use. The diet is said to have a positive effect on the cardiovascular system."
How to use dietary supplements to support a demanding training regimen.,"Dietary supplements can help address nutrient deficiencies, enhance recovery, promote muscle synthesis, boost energy levels, and optimize performance. One key supplement that athletes can consider is β-Alanine, a nonessential amino acid found in dietary sources like poultry and meat. The amino acid is found in meat and poultry, and can be found in poultry, fish, eggs, and poultry products. It is also found in dairy products like yogurt, cheese, fruit, and avocados, among others."
Exploring the role of probiotics in gut health for athletes.,"Probiotics play a crucial role in maintaining gut health for athletes. Multi-strain Lactobacillus and Bifidobacterium probiotic cocktails, supplemented for at least 11 weeks, are most effective in reducing gastrointestinal (GI) symptoms. In the U.S. call the National Suicide Prevention Line on 1-800-273-8255."
Nutritional strategies to prevent dehydration during extended exercise sessions.,"Maintaining adequate hydration throughout the day is crucial. Ensuring a balanced intake of macronutrients (carbohydrates, proteins, fats) supports optimal performance. Pre-hydration with electrolyte-rich beverages like Pedialyte Sport can help slow down dehydration. The more water you drink, the less likely it is to cause dehydration, according to the American College of Obstetricians and Gynaecologists (ACOG) The more hydrated you are, the better your body functions."
Impact of different types of protein sources on muscle recovery.,"The ideal amount of peri-exercise protein intake varies based on factors like caloric intake, total daily protein intake, training status, age, type of protein, and timing of meals. Consuming protein pre- and/or post-workout significantly increases muscle protein synthesis. The optimal amount of protein for a person to consume is between 10 and 15 per cent of their daily calorie intake, depending on age and training status"
"How to adapt a nutrition plan for different types of sports, such as swimming or running.","Athletes should consider the energy demands of their sport. Endurance athletes may require more carbohydrates, while power athletes may prioritize protein and strength training. Working with a sports dietitian can help create a personalized nutrition plan aligned with specific goals and dietary preferences. In the U.S. call the National Suicide Prevention Line on 1-800-273-8255."
The role of antioxidants in reducing exercise-induced oxidative stress.,"Antioxidants play a crucial role in reducing exercise-induced oxidative stress. They help to neutralize reactive oxygen and nitrogen species generated during physical activity. Scientific evidence suggests that the body's natural antioxidant defenses may be insufficient during intense exercise. Additional antioxidants can be beneficial in reducing oxidative stress, according to the National Institutes of Health (NIH) and the American College of Physiotherapists (ACP) The NIH and ACP recommend the use of antioxidants to reduce oxidative stress during exercise"
Guidelines for adjusting macronutrient ratios for different training phases.,"A keto diet may consist of 60-80% fats, 10-30% protein, and 5-10% carbs. The approximate energetic and macronutrient needs vary throughout the training plan. For example, during strength training, a recommended protein intake is 25-35%. Healthy fats are crucial for energy and nutrient absorption. For support in the UK, call the Samaritans on 08457 90 90 90, visit a local Samaritans branch or click here for details."
How to balance dietary needs with personal fitness goals.,"To balance dietary needs with personal fitness goals, one can start by making small changes such as reducing sugary drink intake. Increasing protein intake can also be beneficial for fitness goals. When grocery shopping, it's important to have a list and avoid going hungry. Planning meals ahead of time can help ensure that dietary needs are met. The American Dietetic Association recommends eating a balanced diet every day"
Benefits of high-intensity interval training (HIIT) combined with proper nutrition.,"High-intensity interval training (HIIT) combined with proper nutrition offers numerous benefits. Studies have shown that incorporating HIIT into a fitness routine can lead to improved cardiovascular fitness, increased endurance, and better metabolic health. HIIT workouts include: 20 seconds of intense exercise followed by 10 seconds of rest, repeated for 4 minutes.  HIIT is a form of high-intensity resistance training (HIR) which is a type of interval training. HIR is a style of HIR developed by the American Institute of Strength and Conditioning."
The impact of diet on mental focus and performance during sports.,"Research highlights the impact of nutrition on athletes' physical and mental well-being. Diet plays a crucial role in mental focus and performance during sports. Lifestyle factors and mindset also play integral roles in athletes' overall performance. It is essential for athletes to prioritize a diet rich in nutrients. It's essential for them to eat a balanced, balanced diet with plenty of protein and fibre. It also helps to have a balanced diet that is high in fibre and low in sugar. It can also help them to have more fibre and less sugar."
How to incorporate healthy fats into a diet for better athletic performance.,"Fats are a primary fuel source for light to moderate intensity exercise. Healthy fat sources include avocados, eggs, chorizo, and salsa. Fats provide more energy per gram than carbohydrates or protein. Optimizing blood sugar levels through balanced meals can also improve athletic performance. The American College of Dietetics recommends eating a balanced, balanced diet every day"
